{
  "schema_version": 1,
  "case_id": "wang2007",
  "paper": {
    "citation_key": "wang2007",
    "label": "Wang (2007)"
  },
  "specimen": {
    "body_length_mm": 55.0,
    "body_mass_mg": 300.0,
    "wing_length_mm": 45.0,
    "wing_area_mm2": 350.0
  },
  "simulation_defaults": {
    "frequency_hz": 33.4,
    "rho_air_kg_m3": 1.225,
    "gravity_m_s2": 9.81,
    "wing_cd0": 0.4,
    "wing_cl0": 1.2,
    "n_wingbeats": 5,
    "steps_per_wingbeat": 200,
    "harmonics_per_wingbeat": 7,
    "stroke_plane_angles_deg": {
      "fore": 53.0,
      "hind": 44.0
    },
    "coning_angles_deg": {
      "fore": 8.0,
      "hind": -2.0
    }
  },
  "convention": {
    "source_world_axes": {
      "X": "forward",
      "Y": "left",
      "Z": "up"
    },
    "source_to_sim_rotation": [
      [1.0, 0.0, 0.0],
      [0.0, 1.0, 0.0],
      [0.0, 0.0, 1.0]
    ],
    "source_angle_names": {
      "gamma": "stroke plane angle",
      "phi": "computed as arcsin(s / r_ref)",
      "psi": "computed as pi/2 - beta"
    },
    "source_typos": [],
    "sim_transforms": {
      "gamma": {
        "scale": 1.0,
        "offset_deg": 0.0,
        "phase_shift_deg": 0.0
      },
      "phi": {
        "scale": 1.0,
        "offset_deg": 0.0,
        "phase_shift_deg": 0.0
      },
      "psi": {
        "scale": 1.0,
        "offset_deg": 0.0,
        "phase_shift_deg": 0.0
      }
    },
    "notes": [
      "Wing motion is derived from digitized timeseries and then fit to Fourier components.",
      "Fore/hind phase is encoded directly in fit coefficients."
    ]
  },
  "kinematics": {
    "kind": "timeseries_csv",
    "timeseries": {
      "csv_path": "../../kinematics/wang2007/exp_data.csv",
      "skip_header": 2,
      "time_units": "t/T_wb",
      "columns": {
        "s_fore": {
          "time_col": 0,
          "value_col": 1,
          "units": "mm"
        },
        "s_hind": {
          "time_col": 2,
          "value_col": 3,
          "units": "mm"
        },
        "beta_fore": {
          "time_col": 4,
          "value_col": 5,
          "units": "deg"
        },
        "beta_hind": {
          "time_col": 6,
          "value_col": 7,
          "units": "deg"
        },
        "alpha_fore": {
          "time_col": 8,
          "value_col": 9,
          "units": "deg"
        },
        "alpha_hind": {
          "time_col": 10,
          "value_col": 11,
          "units": "deg"
        },
        "d_fore": {
          "time_col": 12,
          "value_col": 13,
          "units": "mm"
        },
        "d_hind": {
          "time_col": 14,
          "value_col": 15,
          "units": "mm"
        }
      }
    },
    "preprocessing": {
      "smoothing": "fourier_truncation",
      "fit_basis": "least_squares cos/sin harmonics"
    }
  },
  "output_references": [
    {
      "kind": "force_timeseries_csv",
      "name": "cfd_vertical_force",
      "csv_path": "../../kinematics/wang2007/cfd_data.csv",
      "time_column": "t",
      "value_column": "Fz",
      "units": "nondim"
    }
  ]
}
