{
  "schema_version": 1,
  "case_id": "azuma1985",
  "paper": {
    "citation_key": "azuma1985",
    "label": "Azuma (1985)"
  },
  "specimen": {
    "body_length_m": 0.04,
    "body_mass_kg": 0.00026,
    "fore_span_m": 0.0335,
    "fore_area_m2": 0.000221,
    "hind_span_m": 0.0325,
    "hind_area_m2": 0.000272
  },
  "simulation_defaults": {
    "frequency_hz": 41.5,
    "rho_air_kg_m3": 1.225,
    "gravity_m_s2": 9.81,
    "wing_cd0": 0.4,
    "wing_cl0": 1.2,
    "n_harmonics": 3,
    "coning_angles_deg": {
      "fore": 8.0,
      "hind": -2.0
    }
  },
  "convention": {
    "source_world_axes": {
      "X": "backward",
      "Y": "right",
      "Z": "up"
    },
    "source_to_sim_rotation": [
      [-1.0, 0.0, 0.0],
      [0.0, -1.0, 0.0],
      [0.0, 0.0, 1.0]
    ],
    "source_angle_names": {
      "gamma": "stroke plane angle",
      "phi": "flapping angle theta (paper figure typo labels this phi)",
      "psi": "pitch angle"
    },
    "source_typos": [
      "In azuma1985_coords.png, phi in the transform table should be theta."
    ],
    "sim_transforms": {
      "gamma": {
        "scale": 1.0,
        "offset_deg": 0.0,
        "phase_shift_deg": 0.0
      },
      "phi": {
        "scale": -1.0,
        "offset_deg": 0.0,
        "phase_shift_deg": 0.0
      },
      "psi": {
        "scale": 1.0,
        "offset_deg": -90.0,
        "phase_shift_deg": 0.0
      }
    },
    "notes": [
      "Paper world frame (X backward, Y right, Z up) is rotated 180 deg about +Z to simulator frame (X forward, Y left, Z up).",
      "Azuma flapping angle theta has opposite sign to simulator phi in current model mapping.",
      "Azuma pitch angle beta/theta maps to simulator psi by psi_sim = theta - 90 deg."
    ]
  },
  "kinematics": {
    "kind": "fourier_series_deg",
    "angles": {
      "fore": {
        "gamma": {
          "mean_deg": 37.0,
          "terms": []
        },
        "phi": {
          "mean_deg": -3.0,
          "terms": [
            {
              "harmonic": 1,
              "amplitude_deg": -43.0,
              "phase_deg": 0.0
            }
          ]
        },
        "psi": {
          "mean_deg": 98.0,
          "terms": [
            {
              "harmonic": 1,
              "amplitude_deg": -77.0,
              "phase_deg": -49.0
            },
            {
              "harmonic": 2,
              "amplitude_deg": -3.0,
              "phase_deg": 67.0
            },
            {
              "harmonic": 3,
              "amplitude_deg": -8.0,
              "phase_deg": 29.0
            }
          ]
        }
      },
      "hind": {
        "gamma": {
          "mean_deg": 40.0,
          "terms": []
        },
        "phi": {
          "mean_deg": 2.0,
          "terms": [
            {
              "harmonic": 1,
              "amplitude_deg": -47.0,
              "phase_deg": 77.0
            }
          ]
        },
        "psi": {
          "mean_deg": 93.0,
          "terms": [
            {
              "harmonic": 1,
              "amplitude_deg": -65.0,
              "phase_deg": 18.0
            },
            {
              "harmonic": 2,
              "amplitude_deg": 8.0,
              "phase_deg": 74.0
            },
            {
              "harmonic": 3,
              "amplitude_deg": 8.0,
              "phase_deg": 28.0
            }
          ]
        }
      }
    }
  },
  "output_references": [
    {
      "kind": "flight_condition",
      "name": "body_speed_and_direction",
      "speed_m_s": 0.54,
      "direction_deg": 60.0,
      "direction_definition": "atan2(z, x) in XZ plane"
    }
  ]
}
